811134	814870	Jaa nin ɲɔgɔnna cɛfarinw bɛ sɔrɔ Segu yan?	Vraiment! Est-il encore possible d'avoir des braves hommes pareils à  Ségou?
815768	818770	Ayi! jaa cɛw ma ban.	Non! les braves hommes ne sont pas finis.
819956	822470	O fɔra, fulakɛ tɔɔrɔ la.	Cela a choqué le peul.
821860	825270	O fɔlen, a donna kaluwa la.	Après ces interventions, il observa une retraite spirituelle.
824038	826538	k'a ɲinin Ala fɛ < 	pour prier, supplier Dieu
825174	828870	K'a b'a fɛ ko ka kɛlɛ dɔgɔda.	Qu'il voudrait programmer la bataille.
827570	831270	K'a bɛ taga Kaana, ka taga Kaana minanw ta.	Qu'il va attaquer et piller Kaana.
832660	835570	O y'a sɔrɔ jelikɛ kelen b'a bolo.	A l'époque, il n'avait qu'un seul griot.
834570	837070	A bɛ f'o ma <	On l'appelait
835670	838170	Ko jeli Maamu.	Maamou le griot.
837270	842270	Jelikɛ min ko ka di Futa kɛlɛkuntigi Amadu ye Lang Jurubɛ.	Un griot pour qui, le chef de guerre de Fouta avait beaucoup d'affection.
841415	844770	A ye muso fila furu k'a d'a ma.	Il a marié deux femmes pour lui.
843570	847470	Ka jumekurufi sokɛ fila d'a ma.	Lui a offert deux chevaux.
846470	850670	Juma wo juma, a bɛ muso fila ninnu fɛrɛbɔ.	Chaque vendredi, il achetait des habits pour ses deux épouses.
851670	854270	A donni kaluwa la <	Quand il observa son temps de retraite spirituelle
852821	855270	A yirala a la <	Il lui a été fait savoir
853869	856870	K'a tɛ se ka Kaana kɛlɛ.	Qu'il est incapable de combattre Kaana.
855770	860070	Fo a ka jelikɛ mandi n'o ye jeli maamu ye <	A moins que son griot bien aimé, qui est le griot Maamou
858670	861870	Fo'o ka kɛ Kaana kɛlɛ saraka ye.	Qu'il soit le sacrifié de la guerre de kaana.
864970	869270	Aa, fulakɛ bɔr'o kalama kaluwa la,	Ah! quand le peuhl apprit cette condition au moment de sa retraite,
868270	870770	fulakɛ tɔɔrɔ la.	il était très dérangé.
872270	874670	Fulakɛ tɔɔrɔlen <	Le peul dans cet état de dérangement
873670	876279	A bɔra kaluwa la.	Il mit fin à sa retraite spirituelle.
874955	877470	A bɔlen kaluwa la <	A la sortie  de la retraite spirituelle
876362	878310	ɛ,	ah!
877770	880170	Kuma dunduntura.	La nouvelle s'est propagée.
878969	881270	Dugu kɔnɔ.	Dans le village.
880570	885170	Ko Futa kɛlɛkuntigi, k'a donna kaluwa la <	Disant qu'après la retraite invocatrice du chef de guerre de Fouta
883683	886370	K'a ye Kaana kɛlɛ dɔgɔda.	Qu'il a programmé la bataille de Kaana.
885174	888370	Kalo tile mugan ani duuru.	Le vingt-cinq du mois.
887670	890204	Ko mɛ k'a fɔra <	Mais qu'il a été dit
889270	894770	Ko a tɛ se ka Kaana kɛlɛ fo jeli Maamu ka kɛ kɛlɛ saraka ye.	Que la condition pour vaincre Kaana est de sacrifier le griot Maamou.
898460	902460	Jeli Maamu dun ka di Seko Amadu ye.	Alors que le griot Maamou est aimé et admiré par Cheik Amadou.
901470	904270	A ka jelikɛ mandi don,	Il est son griot bien aimé,
902922	905470	jelikɛ in ka farin	un griot fort,
904577	907077	A da la kuma ka di.	Un griot éloquent.
906570	909860	Jelikɛ in jaa la minne don, a tɛ siran.	Ce griot est audacieux et n'a pas peur.
911270	913270	O fɔra <	Cela a été dit
912170	916370	Seko Amadu ye, tumaminna n'a bɔr'o kalama, a  fari fagara.	Cheik Amadou, et il fut attristé par cette nouvelle.
915741	919260	A b'a ka kɛlɛ bɔ a ma.	Jusqu'à vouloir annuler la bataille.
921170	923470	Dondɔ <	Un jour
922370	924870	Musow tagara.	Les femmes sont parties.
924108	926270	Kɔda la.	Au marigot.
925067	927370	U bɛ finiko la.	Elles étaient  en train de faire la lessive.
926570	929470	Jeli Maamu musonin ncinin,	La plus jeune femme du griot Maamou
928270	930870	A tulo donna a la.	Il a appris la nouvelle.
930338	934370	Ko Futa kɛlɛkuntigi ye kɛlɛ dɔgɔda.	Comme quoi, le chef de guerre de Fouta a programmé la bataille.
933863	936170	Ko a fɔra <	Et qu'il est dit
934870	937770	Ko a tɛ se ka Kaana kɛlɛ.	Qu'il ne ne peut pas vaincre Kaana.
936670	940120	Fo jeli Maamu ka kɛ kɛlɛ saraka ye.	Sans avoir fait du griot Maamou un rituel de guerre.
942470	945170	K'a ye kɛlɛ bɔ a ma.	Qu'il a alors décidé d'annuler la bataille.
945580	948270	Jeli Maamu musoni ncinin <	Sa plus jeune femme du griot Maamou
947170	949718	O tulo donn'o la,	Celui-là a appris cela.
948770	952870	A dimina, a y'a ka finiko minɛnw ta.	Elle devint frustrée, et décida de ramasser tous ses matériels de lessive.
951669	957570	 ka na so kɔnɔ, ka n'a cɛ n'o ye jeli Maamu sigilen sɔrɔ so kɔnɔ, ka minɛnw sig'a kɔrɔ,	pour venir à la maison, où elle a posé ses bagages auprès de son mari qui est le griot Maamou,
956070	958260	Ka don so kɔnɔ.	Et entrer dans sa chambre.
962560	964910	A donne so kɔnɔ <	Aussitôt entrée dans la chambre
963970	967370	a cɛ wili la ka don a nɔfɛ.	Son mari aussi s'est levé pour la rejoindre.
966269	969220	A ko ne furu ni n kanu, a kɛra cogodi?	Il lui a dit: "qu'est ce qui ne va pas ma femme et mon amour"?
970960	974860	Ɛ, a ko Futa ka kɛlɛkuntigi <	Alors elle dit: le chef de guerre de Fouta
973869	978070	Futa ka kɛlɛkuntigi ka jelikɛ <	Le griot du chef de guerre de Fouta
976750	979270	Jeli Maamu <	Le griot Maamou
978060	981870	E bolo dalen filɛ ne barakɔrɔ la yɔrɔ min na<	Là où ta main est posée, au bas de mon ventre
980657	983960	Ni cɛbakɔrɔ bolo ni nin deli la <	Toute personne habituée à cela
983035	985870	Cɛw sa don, i tɛ sɔn ka sa.	N'accepterait pas de mourir le jour de la mort des autres.
988060	991330	Amadu Seko ka jelikɛ mandi <	Le griot bien-aimé de Cheik Amadou
990122	994270	E bolo dalen filɛ ne bara yɔrɔ min na <	là où ta main est posée au bas de mon ventre,
992970	999570	Ni cɛ bolo dara nin na, n'i bolo ni nin deli la, ni saya nana, i tɛ sɔn ka sa.	Toute personne dont la main est habituée, au moment de mourir, tu n'accepterais jamais.
999970	1004770	Ee, a ko ne furu ni n kanu, e ye nin fɔ mun na?	Eh! il dit : "ma conjointe et mon amour, pourquoi as tu dit cela"?
1006562	1008970	Aa, a ko	Ah! il dit:
1007960	1012070	Basi tɛ, ko nin ye tiɲɛ ye, tiɲɛ fɔra sisan.	Il n'y a pas de problème, c'est réel, tu as maintenant dit la vérité.
1012834	1015170	O fɔra dɔrɔn <	Juste après cela
1014470	1017070	a ko ne furu ni n kanu,	il dit: "ma conjointe et mon amour,
1016370	1020970	n bɔra nin kalama, i y'a fɔ n ye, a diyara n ye a bɛn na n ma.	j'ai appris cela, tu m'as donné l'information et ce fut un plaisir pour moi.
1022254	1024970	O yɔrɔ bɛɛ, a y'a ka marifa ta.	Soudain, il prit son arme.
1023970	1027270	Jeli ka marifa de y'i ka ngɔni ye.	L'arme d'un griot est sa guitare.
1026170	1028870	A y'a ka ngɔni ta.	Il a pris sa guitare.
1027826	1031970	A ye Amadu Seku ka bulon wolonfila sɛgɛrɛ.	Il se dirigea vers les sept vestibules de Amadou Sékou.
1032670	1035170	A ye salamu di.	Il a salué.
1034139	1036670	U ye salamu kanda.	Ils ont répondu à la salutation.
1035670	1038570	A y'i sigi n'a ka ngɔni ye.	Il s'est assis avec sa guitare.
1037970	1040570	A bɛ ka ngɔni fɔ.	Il s'est mis à jouer de la guitare.
1039770	1042270	A bɛ ka ngɔni fɔ.	Il etait entrain de jouer de la guitare.
1042061	1044561	A ko Amadu Seku <	Il dit: "Amadou Sékou
1044170	1046670	Lang jurubɛ.	Lang Djurubè.
1048823	1052770	Kaana kɛlɛ ko, ne ko, a bɛ cogodi i bolo?	Comment est le projet de la bataille de Kaana à ton niveau?
1055170	1057570	Aa!	Ah!
1056270	1059070	A ko ne ka jelikɛ mandi <	Il dit: "moi mon griot bien aimé
1058132	1060570	Kaana kɛlɛ?	La bataille de Kaana?
1059470	1063060	n y'a bɔ a ma, n y'a bila.	je l'ai annulé et laissé tomber".
1064970	1068070	Ee, a ko k'a dɔgɔda k'a bila?	Eh! s'exclama le griot: "le programmé et laisser tomber ensuite?"
1066670	1069070	A ko anhan.	Il répondit, oui.
1067980	1071570	Ne tun y'a dɔgɔda, mɛ n y'a bɔ a ma.	C'est moi qui l'avais programmé, mais je l'ai annulé.
1070170	1072670	A ko munna?	Il lui demanda: pourquoi?
1072945	1076360	A ko surɔ ne jeli Maamu sugora.	Il lui dit: "hier nuit, moi griot Maamou ai rêvé.
1075460	1078970	n ko ne de ka kan ka kɛ Kaana kɛlɛ saraka ye.	que c'est moi qui dois être le sacrifice rituel pour la bataille de Kaana".
1080470	1083570	N'i ma taga Kaana kɛlɛ,	 Si tu ne vas pas combattre Kaana,
1082352	1087270	Ne Maamu, ne kelen bɛ bɔ n bɛ taa bin Kaana kan, hali ni n bɛ to yen.	Moi Maamou, je partirai seul, attaquer Kaana, même s'il faut que je périsse là-bas.
1090910	1093060	A ko:	Il dit:
